{"$schema":"https://json-schema.org/draft/2020-12/schema","$id":"https://github.com/gshan1209-cell/Chinese-Idiom-Chain-Game/data/cards/card-number-registry.schema.json","title":"CICG Project-Wide Rarity Card Number Registry","type":"object","additionalProperties":false,"required":["schemaVersion","registryId","numberingPolicy","raritySequences","cards"],"properties":{"schemaVersion":{"const":1},"registryId":{"const":"cicg-project-card-numbers"},"numberingPolicy":{"type":"object","additionalProperties":false,"required":["format","scope","sequenceStartsAt","immutableAfterAssignment","reuseRetiredNumbers","supportedRarities","licenseGateRequiredFor"],"properties":{"format":{"const":"{rarity}-{sequence:0000}"},"scope":{"const":"project-wide-per-rarity"},"sequenceStartsAt":{"const":1},"immutableAfterAssignment":{"const":true},"reuseRetiredNumbers":{"const":false},"supportedRarities":{"type":"array","prefixItems":[{"const":"N"},{"const":"R"},{"const":"SR"},{"const":"SSR"},{"const":"UR"}],"minItems":5,"maxItems":5},"licenseGateRequiredFor":{"type":"array","prefixItems":[{"const":"UR"}],"minItems":1,"maxItems":1}}},"raritySequences":{"type":"object","additionalProperties":false,"required":["N","R","SR","SSR","UR"],"properties":{"N":{"type":"object","additionalProperties":false,"required":["assignedCount","nextSequence"],"properties":{"assignedCount":{"type":"integer","minimum":0,"maximum":9999},"nextSequence":{"type":"integer","minimum":1,"maximum":9999}}},"R":{"type":"object","additionalProperties":false,"required":["assignedCount","nextSequence"],"properties":{"assignedCount":{"type":"integer","minimum":0,"maximum":9999},"nextSequence":{"type":"integer","minimum":1,"maximum":9999}}},"SR":{"type":"object","additionalProperties":false,"required":["assignedCount","nextSequence"],"properties":{"assignedCount":{"type":"integer","minimum":0,"maximum":9999},"nextSequence":{"type":"integer","minimum":1,"maximum":9999}}},"SSR":{"type":"object","additionalProperties":false,"required":["assignedCount","nextSequence"],"properties":{"assignedCount":{"type":"integer","minimum":0,"maximum":9999},"nextSequence":{"type":"integer","minimum":1,"maximum":9999}}},"UR":{"type":"object","additionalProperties":false,"required":["assignedCount","nextSequence"],"properties":{"assignedCount":{"type":"integer","minimum":0,"maximum":9999},"nextSequence":{"type":"integer","minimum":1,"maximum":9999}}}}},"cards":{"type":"array","items":{"type":"object","additionalProperties":false,"required":["chapterId","catalogOrder","idiomId","idiomText","rarity","sequence","cardNumber","status"],"properties":{"chapterId":{"type":"string","minLength":1},"catalogOrder":{"type":"integer","minimum":1},"idiomId":{"type":"string","pattern":"^idiom-[0-9]{4}$"},"idiomText":{"type":"string","minLength":4,"maxLength":4},"rarity":{"enum":["N","R","SR","SSR","UR"]},"sequence":{"type":"integer","minimum":1,"maximum":9999},"cardNumber":{"type":"string","pattern":"^(N|R|SR|SSR|UR)-[0-9]{4}$"},"status":{"enum":["active","retired"]}}}}}}
