{"schemaVersion":1,"registryId":"cicg-project-card-numbers","numberingPolicy":{"format":"{rarity}-{sequence:0000}","scope":"project-wide-per-rarity","sequenceStartsAt":1,"immutableAfterAssignment":true,"reuseRetiredNumbers":false,"supportedRarities":["N","R","SR","SSR","UR"],"licenseGateRequiredFor":["UR"]},"raritySequences":{"N":{"assignedCount":12,"nextSequence":13},"R":{"assignedCount":18,"nextSequence":19},"SR":{"assignedCount":23,"nextSequence":24},"SSR":{"assignedCount":8,"nextSequence":9},"UR":{"assignedCount":0,"nextSequence":1}},"cards":[{"chapterId":"chapter-1","catalogOrder":1,"idiomId":"idiom-0001","idiomText":"一心一意","rarity":"R","sequence":1,"cardNumber":"R-0001","status":"active"},{"chapterId":"chapter-1","catalogOrder":2,"idiomId":"idiom-0002","idiomText":"意氣風發","rarity":"SR","sequence":1,"cardNumber":"SR-0001","status":"active"},{"chapterId":"chapter-1","catalogOrder":3,"idiomId":"idiom-0003","idiomText":"發揚光大","rarity":"SSR","sequence":1,"cardNumber":"SSR-0001","status":"active"},{"chapterId":"chapter-1","catalogOrder":4,"idiomId":"idiom-0004","idiomText":"大公無私","rarity":"SSR","sequence":2,"cardNumber":"SSR-0002","status":"active"},{"chapterId":"chapter-1","catalogOrder":5,"idiomId":"idiom-0005","idiomText":"私心雜念","rarity":"N","sequence":1,"cardNumber":"N-0001","status":"active"},{"chapterId":"chapter-1","catalogOrder":6,"idiomId":"idiom-0006","idiomText":"念念不忘","rarity":"R","sequence":2,"cardNumber":"R-0002","status":"active"},{"chapterId":"chapter-1","catalogOrder":7,"idiomId":"idiom-0007","idiomText":"忘恩負義","rarity":"N","sequence":2,"cardNumber":"N-0002","status":"active"},{"chapterId":"chapter-1","catalogOrder":8,"idiomId":"idiom-0008","idiomText":"義不容辭","rarity":"SSR","sequence":3,"cardNumber":"SSR-0003","status":"active"},{"chapterId":"chapter-1","catalogOrder":9,"idiomId":"idiom-0009","idiomText":"辭舊迎新","rarity":"R","sequence":3,"cardNumber":"R-0003","status":"active"},{"chapterId":"chapter-1","catalogOrder":10,"idiomId":"idiom-0010","idiomText":"新陳代謝","rarity":"R","sequence":4,"cardNumber":"R-0004","status":"active"},{"chapterId":"chapter-1","catalogOrder":11,"idiomId":"idiom-0011","idiomText":"謝天謝地","rarity":"R","sequence":5,"cardNumber":"R-0005","status":"active"},{"chapterId":"chapter-1","catalogOrder":12,"idiomId":"idiom-0012","idiomText":"地久天長","rarity":"R","sequence":6,"cardNumber":"R-0006","status":"active"},{"chapterId":"chapter-1","catalogOrder":13,"idiomId":"idiom-0013","idiomText":"長年累月","rarity":"R","sequence":7,"cardNumber":"R-0007","status":"active"},{"chapterId":"chapter-1","catalogOrder":14,"idiomId":"idiom-0014","idiomText":"月下老人","rarity":"R","sequence":8,"cardNumber":"R-0008","status":"active"},{"chapterId":"chapter-1","catalogOrder":15,"idiomId":"idiom-0015","idiomText":"人山人海","rarity":"R","sequence":9,"cardNumber":"R-0009","status":"active"},{"chapterId":"chapter-1","catalogOrder":16,"idiomId":"idiom-0016","idiomText":"海闊天空","rarity":"SR","sequence":2,"cardNumber":"SR-0002","status":"active"},{"chapterId":"chapter-1","catalogOrder":17,"idiomId":"idiom-0017","idiomText":"空前絕後","rarity":"SR","sequence":3,"cardNumber":"SR-0003","status":"active"},{"chapterId":"chapter-1","catalogOrder":18,"idiomId":"idiom-0018","idiomText":"後來居上","rarity":"SR","sequence":4,"cardNumber":"SR-0004","status":"active"},{"chapterId":"chapter-1","catalogOrder":19,"idiomId":"idiom-0019","idiomText":"上行下效","rarity":"N","sequence":3,"cardNumber":"N-0003","status":"active"},{"chapterId":"chapter-1","catalogOrder":20,"idiomId":"idiom-0020","idiomText":"效犬馬力","rarity":"R","sequence":10,"cardNumber":"R-0010","status":"active"},{"chapterId":"chapter-1","catalogOrder":21,"idiomId":"idiom-0021","idiomText":"力爭上游","rarity":"SSR","sequence":4,"cardNumber":"SSR-0004","status":"active"},{"chapterId":"chapter-1","catalogOrder":22,"idiomId":"idiom-0022","idiomText":"游刃有餘","rarity":"SR","sequence":5,"cardNumber":"SR-0005","status":"active"},{"chapterId":"chapter-1","catalogOrder":23,"idiomId":"idiom-0023","idiomText":"餘音繞梁","rarity":"SR","sequence":6,"cardNumber":"SR-0006","status":"active"},{"chapterId":"chapter-1","catalogOrder":24,"idiomId":"idiom-0024","idiomText":"梁上君子","rarity":"N","sequence":4,"cardNumber":"N-0004","status":"active"},{"chapterId":"chapter-1","catalogOrder":25,"idiomId":"idiom-0025","idiomText":"子虛烏有","rarity":"N","sequence":5,"cardNumber":"N-0005","status":"active"},{"chapterId":"chapter-1","catalogOrder":26,"idiomId":"idiom-0026","idiomText":"有始有終","rarity":"SR","sequence":7,"cardNumber":"SR-0007","status":"active"},{"chapterId":"chapter-1","catalogOrder":27,"idiomId":"idiom-0027","idiomText":"終身大事","rarity":"R","sequence":11,"cardNumber":"R-0011","status":"active"},{"chapterId":"chapter-1","catalogOrder":28,"idiomId":"idiom-0028","idiomText":"事半功倍","rarity":"SR","sequence":8,"cardNumber":"SR-0008","status":"active"},{"chapterId":"chapter-1","catalogOrder":29,"idiomId":"idiom-0033","idiomText":"人定勝天","rarity":"SSR","sequence":5,"cardNumber":"SSR-0005","status":"active"},{"chapterId":"chapter-1","catalogOrder":30,"idiomId":"idiom-0034","idiomText":"天長地久","rarity":"R","sequence":12,"cardNumber":"R-0012","status":"active"},{"chapterId":"chapter-1","catalogOrder":31,"idiomId":"idiom-0035","idiomText":"久別重逢","rarity":"R","sequence":13,"cardNumber":"R-0013","status":"active"},{"chapterId":"chapter-1","catalogOrder":32,"idiomId":"idiom-0036","idiomText":"逢凶化吉","rarity":"SR","sequence":9,"cardNumber":"SR-0009","status":"active"},{"chapterId":"chapter-1","catalogOrder":33,"idiomId":"idiom-0037","idiomText":"吉祥如意","rarity":"SR","sequence":10,"cardNumber":"SR-0010","status":"active"},{"chapterId":"chapter-1","catalogOrder":34,"idiomId":"idiom-0038","idiomText":"意氣用事","rarity":"N","sequence":6,"cardNumber":"N-0006","status":"active"},{"chapterId":"chapter-1","catalogOrder":35,"idiomId":"idiom-0039","idiomText":"事必躬親","rarity":"SR","sequence":11,"cardNumber":"SR-0011","status":"active"},{"chapterId":"chapter-1","catalogOrder":36,"idiomId":"idiom-0029","idiomText":"意想不到","rarity":"R","sequence":14,"cardNumber":"R-0014","status":"active"},{"chapterId":"chapter-1","catalogOrder":37,"idiomId":"idiom-0030","idiomText":"到此為止","rarity":"N","sequence":7,"cardNumber":"N-0007","status":"active"},{"chapterId":"chapter-1","catalogOrder":38,"idiomId":"idiom-0031","idiomText":"止於至善","rarity":"SSR","sequence":6,"cardNumber":"SSR-0006","status":"active"},{"chapterId":"chapter-1","catalogOrder":39,"idiomId":"idiom-0032","idiomText":"善始善終","rarity":"SR","sequence":12,"cardNumber":"SR-0012","status":"active"},{"chapterId":"chapter-1","catalogOrder":40,"idiomId":"idiom-0040","idiomText":"親力親為","rarity":"SR","sequence":13,"cardNumber":"SR-0013","status":"active"},{"chapterId":"chapter-1","catalogOrder":41,"idiomId":"idiom-0041","idiomText":"為人師表","rarity":"SSR","sequence":7,"cardNumber":"SSR-0007","status":"active"},{"chapterId":"chapter-1","catalogOrder":42,"idiomId":"idiom-0042","idiomText":"表裡如一","rarity":"SR","sequence":14,"cardNumber":"SR-0014","status":"active"},{"chapterId":"chapter-1","catalogOrder":43,"idiomId":"idiom-0043","idiomText":"一鳴驚人","rarity":"SSR","sequence":8,"cardNumber":"SSR-0008","status":"active"},{"chapterId":"chapter-1","catalogOrder":44,"idiomId":"idiom-0044","idiomText":"人傑地靈","rarity":"SR","sequence":15,"cardNumber":"SR-0015","status":"active"},{"chapterId":"chapter-1","catalogOrder":45,"idiomId":"idiom-0045","idiomText":"靈丹妙藥","rarity":"R","sequence":15,"cardNumber":"R-0015","status":"active"},{"chapterId":"chapter-1","catalogOrder":46,"idiomId":"idiom-0046","idiomText":"藥到病除","rarity":"SR","sequence":16,"cardNumber":"SR-0016","status":"active"},{"chapterId":"chapter-1","catalogOrder":47,"idiomId":"idiom-0047","idiomText":"除舊布新","rarity":"SR","sequence":17,"cardNumber":"SR-0017","status":"active"},{"chapterId":"chapter-1","catalogOrder":48,"idiomId":"idiom-0048","idiomText":"新婚燕爾","rarity":"R","sequence":16,"cardNumber":"R-0016","status":"active"},{"chapterId":"chapter-1","catalogOrder":49,"idiomId":"idiom-0049","idiomText":"爾虞我詐","rarity":"N","sequence":8,"cardNumber":"N-0008","status":"active"},{"chapterId":"chapter-1","catalogOrder":50,"idiomId":"idiom-0050","idiomText":"山高水長","rarity":"SR","sequence":18,"cardNumber":"SR-0018","status":"active"},{"chapterId":"chapter-1","catalogOrder":51,"idiomId":"idiom-0051","idiomText":"長驅直入","rarity":"N","sequence":9,"cardNumber":"N-0009","status":"active"},{"chapterId":"chapter-1","catalogOrder":52,"idiomId":"idiom-0052","idiomText":"入木三分","rarity":"SR","sequence":19,"cardNumber":"SR-0019","status":"active"},{"chapterId":"chapter-1","catalogOrder":53,"idiomId":"idiom-0053","idiomText":"分秒必爭","rarity":"SR","sequence":20,"cardNumber":"SR-0020","status":"active"},{"chapterId":"chapter-1","catalogOrder":54,"idiomId":"idiom-0054","idiomText":"爭先恐後","rarity":"R","sequence":17,"cardNumber":"R-0017","status":"active"},{"chapterId":"chapter-1","catalogOrder":55,"idiomId":"idiom-0055","idiomText":"後生可畏","rarity":"SR","sequence":21,"cardNumber":"SR-0021","status":"active"},{"chapterId":"chapter-1","catalogOrder":56,"idiomId":"idiom-0056","idiomText":"畏首畏尾","rarity":"N","sequence":10,"cardNumber":"N-0010","status":"active"},{"chapterId":"chapter-1","catalogOrder":57,"idiomId":"idiom-0057","idiomText":"尾大不掉","rarity":"N","sequence":11,"cardNumber":"N-0011","status":"active"},{"chapterId":"chapter-1","catalogOrder":58,"idiomId":"idiom-0058","idiomText":"掉以輕心","rarity":"N","sequence":12,"cardNumber":"N-0012","status":"active"},{"chapterId":"chapter-1","catalogOrder":59,"idiomId":"idiom-0059","idiomText":"心曠神怡","rarity":"SR","sequence":22,"cardNumber":"SR-0022","status":"active"},{"chapterId":"chapter-1","catalogOrder":60,"idiomId":"idiom-0060","idiomText":"怡然自得","rarity":"R","sequence":18,"cardNumber":"R-0018","status":"active"},{"chapterId":"chapter-1","catalogOrder":61,"idiomId":"idiom-0061","idiomText":"得心應手","rarity":"SR","sequence":23,"cardNumber":"SR-0023","status":"active"}]}
